{
  "schemaVersion": 1,
  "catalogVersion": "0.2.0",
  "asOf": "2026-10-26",
  "note": "Metadata and links only. Every statement is traceable to a public document at the pinned revision; no dataset, report body or coordinate is copied. Status fields describe four separate dimensions and are never combined.",
  "pins": {
    "geoimpact-ci": { "repo": "soroushkarahrodi79-oss/geoimpact-ci", "sha": "c39733b61b60abe3b6e9e9c50f74f5c206022399" },
    "madrid-lens": { "repo": "soroushkarahrodi79-oss/madrid-tourism-intelligence-lens", "sha": "704fffb2848f9f9780f5ad2b84aeb71750e46f73" },
    "salmas": { "repo": "soroushkarahrodi79-oss/salmas-flood-spatial-forensics", "sha": "97be23c1d9a5c2548daa3772375e235b59f98b30" },
    "lab": { "repo": "soroushkarahrodi79-oss/sk-spatial-intelligence-lab", "sha": "1d430a8f8f99405666173f57d5a05b855502566d" }
  },
  "records": [
    {
      "id": "EV-GIC-001",
      "project": "geoimpact-ci",
      "type": "real-source-case",
      "dataOrigin": "real-source",
      "title": { "en": "Madrid census-section boundary change", "es": "Cambio de secciones censales de Madrid" },
      "question": { "en": "If two official versions of Madrid census sections differ, how many fixed address points change section?", "es": "Si dos versiones oficiales de las secciones censales de Madrid difieren, ¿cuántos puntos de dirección fijos cambian de sección?" },
      "finding": { "en": "On a bounded, frozen subset (37 BASE and 49 CANDIDATE sections, 2,112 fixed address points) GeoImpact-CI recorded 2,112 assignment changes across 26 old-to-new section pairs and a policy BLOCK.", "es": "En un subconjunto acotado y congelado (37 secciones BASE, 49 CANDIDATE y 2.112 puntos de dirección fijos), GeoImpact-CI registró 2.112 cambios de asignación entre 26 pares de secciones antiguas y nuevas, y un veredicto de política BLOCK." },
      "limitations": { "en": "The result is a spatial counterfactual: 2026 address points are tested against 2024 and 2025 section versions, so it is not a time-aligned historical impact estimate. BLOCK is a policy decision on a zero-threshold exploratory setting, not geographic truth. INE's dataset-specific reuse licence is unconfirmed.", "es": "El resultado es un contrafactual espacial: los puntos de dirección de 2026 se contrastan con las secciones de 2024 y 2025, de modo que no es una estimación de impacto histórico alineada en el tiempo. BLOCK es una decisión de política con un umbral cero exploratorio, no una verdad geográfica. La licencia de reutilización específica del INE no está confirmada." },
      "scope": {
        "geographic": { "en": "Madrid municipality; bounded subset around changed sections only", "es": "Municipio de Madrid; subconjunto acotado alrededor de las secciones modificadas" },
        "temporal": { "en": "Section versions 2024 and 2025; address snapshot retrieved 2026-10-03", "es": "Versiones de secciones de 2024 y 2025; instantánea de direcciones obtenida el 2026-10-03" }
      },
      "reproducibility": { "en": "Four input files have recorded SHA-256 values and the expected BLOCK result is enforced as a CI contract on Linux and Windows.", "es": "Cuatro archivos de entrada tienen valores SHA-256 registrados y el resultado BLOCK esperado se exige como contrato de CI en Linux y Windows." },
      "status": { "sourceProvenance": "pinned", "reproducibility": "ci-contract", "scientificValidation": "none-claimed", "independentReview": "none-recorded" },
      "sources": [
        { "role": "evidence", "label": "GATE_5_REAL_WORLD_CASE.md", "url": "https://github.com/soroushkarahrodi79-oss/geoimpact-ci/blob/c39733b61b60abe3b6e9e9c50f74f5c206022399/docs/GATE_5_REAL_WORLD_CASE.md", "pin": "c39733b61b60abe3b6e9e9c50f74f5c206022399" },
        { "role": "methodology", "label": "GATE_6_REAL_WORLD_BENCHMARK.md", "url": "https://github.com/soroushkarahrodi79-oss/geoimpact-ci/blob/c39733b61b60abe3b6e9e9c50f74f5c206022399/docs/GATE_6_REAL_WORLD_BENCHMARK.md", "pin": "c39733b61b60abe3b6e9e9c50f74f5c206022399" },
        { "role": "methodology", "label": "GATE_5_SOURCE_REGISTER.md", "url": "https://github.com/soroushkarahrodi79-oss/geoimpact-ci/blob/c39733b61b60abe3b6e9e9c50f74f5c206022399/docs/GATE_5_SOURCE_REGISTER.md", "pin": "c39733b61b60abe3b6e9e9c50f74f5c206022399" }
      ],
      "claims": [
        {
          "id": "CL-GIC-001-01",
          "source": "https://github.com/soroushkarahrodi79-oss/geoimpact-ci/blob/c39733b61b60abe3b6e9e9c50f74f5c206022399/docs/GATE_5_REAL_WORLD_CASE.md",
          "status": { "traceStatus": "line-range-checked", "scientificValidation": "none-claimed", "independentReview": "none-recorded" },
          "statements": {
            "claim": {
              "text": { "en": "The GeoImpact CLI run on the checked-in subset reported 2,112 address-point relationship changes, all recorded as assignment_changed, across 26 distinct old-to-new section ID pairs, with a BLOCK verdict.", "es": "La ejecución de la CLI de GeoImpact sobre el subconjunto incluido en el repositorio registró 2.112 cambios de relación de puntos de dirección, todos como assignment_changed, entre 26 pares distintos de ID de sección antigua y nueva, con veredicto BLOCK." },
              "lines": [53, 61],
              "permalink": "https://github.com/soroushkarahrodi79-oss/geoimpact-ci/blob/c39733b61b60abe3b6e9e9c50f74f5c206022399/docs/GATE_5_REAL_WORLD_CASE.md#L53-L61",
              "terms": ["BLOCK / 1 (completed analysis)", "Relationship changes | 2,112 `assignment_changed`", "Distinct old→new section ID pairs | 26"]
            },
            "method": {
              "text": { "en": "The figures come from a deterministic, checked-in local subset (37 BASE polygons, 49 CANDIDATE polygons, 2,112 unique address points), not complete city coverage; point locations are held fixed across the two boundary versions.", "es": "Las cifras proceden de un subconjunto local determinista incluido en el repositorio (37 polígonos BASE, 49 CANDIDATE y 2.112 puntos de dirección únicos), no de la cobertura completa de la ciudad; las ubicaciones de los puntos se mantienen fijas entre las dos versiones de límites." },
              "lines": [33, 40],
              "permalink": "https://github.com/soroushkarahrodi79-oss/geoimpact-ci/blob/c39733b61b60abe3b6e9e9c50f74f5c206022399/docs/GATE_5_REAL_WORLD_CASE.md#L33-L40",
              "terms": ["a deterministic, local subset, not complete city coverage", "37 BASE polygons, 49 CANDIDATE polygons, and 2,112 unique address points", "locations are held fixed across the two boundary versions"]
            },
            "limitation": {
              "text": { "en": "The source does not establish the exact effective dates or administrative rationale for every 2024-to-2025 geometry change, and the address snapshot is from 2026, so the result is not a time-aligned historical impact estimate; it does not validate legal, electoral or statistical decisions for individual locations.", "es": "La fuente no establece las fechas de efecto exactas ni la justificación administrativa de cada cambio de geometría de 2024 a 2025, y la instantánea de direcciones es de 2026, por lo que el resultado no es una estimación de impacto histórico alineada en el tiempo; no valida decisiones legales, electorales ni estadísticas sobre ubicaciones concretas." },
              "lines": [130, 136],
              "permalink": "https://github.com/soroushkarahrodi79-oss/geoimpact-ci/blob/c39733b61b60abe3b6e9e9c50f74f5c206022399/docs/GATE_5_REAL_WORLD_CASE.md#L130-L136",
              "terms": ["it is not a time-aligned historical impact estimate", "does not validate legal, electoral, or statistical decisions for individual locations"]
            }
          }
        }
      ],
      "relatedTo": ["EV-LAB-001"]
    },
    {
      "id": "EV-GIC-002",
      "project": "geoimpact-ci",
      "type": "real-source-case",
      "dataOrigin": "real-source",
      "title": { "en": "Sierra de Baza boundary update (negative control)", "es": "Actualización del límite de Sierra de Baza (control negativo)" },
      "question": { "en": "Does an official protected-area boundary update change which fixed public-use facilities fall inside the park?", "es": "¿Una actualización oficial del límite de un espacio protegido cambia qué equipamientos de uso público fijos quedan dentro del parque?" },
      "finding": { "en": "For 52 fixed facility points GeoImpact-CI recorded 0 relationship changes, 0 regressions and a policy PASS between the 2015 and December 2025 park boundaries. Gate 8 accepted it as a negative control, not as a demonstration of impact.", "es": "Para 52 puntos de equipamiento fijos, GeoImpact-CI registró 0 cambios de relación, 0 regresiones y un veredicto PASS entre los límites del parque de 2015 y de diciembre de 2025. La Gate 8 lo aceptó como control negativo, no como demostración de impacto." },
      "limitations": { "en": "The facility inventory was retrieved on 2026-10-05 and is not aligned with either boundary date. Geometry alone cannot show administrative intent, legal effect, access or service. The current boundary and facility layers need separate rights confirmation beyond the CC BY 4.0 stated for the 2015 layer.", "es": "El inventario de equipamientos se obtuvo el 2026-10-05 y no coincide con ninguna de las fechas de los límites. La geometría por sí sola no muestra intención administrativa, efecto legal, acceso ni servicio. Los límites y equipamientos actuales requieren confirmar derechos por separado, más allá de la licencia CC BY 4.0 indicada para la capa de 2015." },
      "scope": {
        "geographic": { "en": "Sierra de Baza Natural Park, Andalusia, Spain", "es": "Parque Natural Sierra de Baza, Andalucía, España" },
        "temporal": { "en": "Boundaries May 2015 and December 2025; facilities snapshot 2026-10-05", "es": "Límites de mayo de 2015 y diciembre de 2025; instantánea de equipamientos del 2026-10-05" }
      },